{
  "schema": "https://event-atoms.com/schemas/composition-v1.json",
  "type": "stream",
  "id": "event-atoms/streams/olympus-agent-session-flow",
  "version": "1.0.0",
  "name": "Olympus Agent Session Flow",
  "description": "Event stream for an Olympus agent session: start, tool dispatches, policy checks, and completion.",
  "references": {
    "event_type": {
      "ref": "event-atoms://atoms/event-type/agent-session-started",
      "version": "1.0.0"
    },
    "channel": {
      "ref": "event-atoms://atoms/channel/olympus-broker-internal",
      "version": "1.0.0"
    },
    "subscription_pattern": {
      "ref": "event-atoms://atoms/subscription-pattern/session-lifecycle",
      "version": "1.0.0"
    },
    "delivery_semantics": {
      "ref": "event-atoms://atoms/delivery-semantics/exactly-once-fifo",
      "version": "1.0.0"
    }
  },
  "tags": ["olympus", "agent", "session", "policy"]
}
