{
  "schema": "https://event-atoms.com/schemas/composition-v1.json",
  "type": "stream",
  "id": "event-atoms/streams/atoms-catalog-deploy-flow",
  "version": "1.0.0",
  "name": "Atoms Catalog Deploy Flow",
  "description": "Cross-system flow: PR merged to main triggers catalog rebuild, validator run, and site deployment.",
  "references": {
    "event_type": {
      "ref": "event-atoms://atoms/event-type/github-pr-merged",
      "version": "1.0.0"
    },
    "channel": {
      "ref": "event-atoms://atoms/channel/github-actions-webhook",
      "version": "1.0.0"
    },
    "subscription_pattern": {
      "ref": "event-atoms://atoms/subscription-pattern/filter-by-branch",
      "version": "1.0.0"
    },
    "delivery_semantics": {
      "ref": "event-atoms://atoms/delivery-semantics/at-least-once-fifo",
      "version": "1.0.0"
    }
  },
  "tags": ["atoms", "ci-cd", "deploy", "catalog"]
}
