{
  "schema": "https://event-atoms.com/schemas/composition-v1.json",
  "type": "stream",
  "id": "event-atoms/streams/schema-validation-flow",
  "version": "1.0.0",
  "name": "Schema Validation Flow",
  "description": "Event flow emitted when atoms are validated against their schemas: validates, passes or fails, reports.",
  "references": {
    "event_type": {
      "ref": "event-atoms://atoms/event-type/atoms-catalog-published",
      "version": "1.0.0"
    },
    "channel": {
      "ref": "event-atoms://atoms/channel/atoms-validator-pipeline",
      "version": "1.0.0"
    },
    "subscription_pattern": {
      "ref": "event-atoms://atoms/subscription-pattern/on-catalog-publish",
      "version": "1.0.0"
    },
    "delivery_semantics": {
      "ref": "event-atoms://atoms/delivery-semantics/at-least-once-unordered",
      "version": "1.0.0"
    }
  },
  "tags": ["validation", "schema", "catalog", "quality"]
}
